{
  "protocolVersion": 1,
  "messageId": "msg-obs-capture-1",
  "sessionId": "s-cap-fx",
  "type": "observations_up",
  "origin": "watch",
  "sentAt": "2026-09-25T10:56:00Z",
  "payload": {
    "events": [
      {
        "eventId": "e-fx-set",
        "entryId": "e-fx-set",
        "kind": "set",
        "loggedAt": "2026-09-25T10:05:00Z",
        "sessionExerciseId": "sx-bench",
        "exerciseId": "ex-bench",
        "reps": 5,
        "loadKg": 80
      },
      {
        "eventId": "e-fx-run",
        "entryId": "e-fx-run",
        "kind": "timed",
        "loggedAt": "2026-09-25T10:26:00Z",
        "sessionExerciseId": "sx-run",
        "exerciseId": "ex-run",
        "startedAt": "2026-09-25T10:06:00Z",
        "endedAt": "2026-09-25T10:26:00Z",
        "avgHeartRateBpm": 140,
        "maxHeartRateBpm": 160,
        "steps": 3200
      },
      {
        "eventId": "e-fx-r2",
        "entryId": "e-fx-r2",
        "kind": "round",
        "loggedAt": "2026-09-25T10:37:05Z",
        "sessionExerciseId": "sx-bjj",
        "exerciseId": "ex-bjj",
        "startedAt": "2026-09-25T10:30:00Z",
        "endedAt": "2026-09-25T10:37:00Z",
        "roundNumber": 2,
        "avgHeartRateBpm": 165,
        "maxHeartRateBpm": 180,
        "pausedMs": 120000
      },
      {
        "eventId": "e-fx-plank",
        "entryId": "e-fx-plank",
        "kind": "hold",
        "loggedAt": "2026-09-25T10:41:00Z",
        "sessionExerciseId": "sx-plank",
        "exerciseId": "ex-plank",
        "startedAt": "2026-09-25T10:40:00Z",
        "endedAt": "2026-09-25T10:41:00Z",
        "avgHeartRateBpm": 120,
        "maxHeartRateBpm": 130
      },
      {
        "eventId": "rating-s-cap-fx",
        "entryId": "rating-s-cap-fx",
        "kind": "effort_rating",
        "loggedAt": "2026-09-25T10:55:20Z",
        "rating": 4
      },
      {
        "eventId": "end-s-cap-fx",
        "entryId": "end-s-cap-fx",
        "kind": "session_end",
        "loggedAt": "2026-09-25T10:55:00Z",
        "startedAt": "2026-09-25T10:00:00Z",
        "endedAt": "2026-09-25T10:55:00Z",
        "status": "completed",
        "avgHeartRateBpm": 143,
        "maxHeartRateBpm": 180,
        "setBlockHeartRates": [
          {
            "sessionExerciseId": "sx-bench",
            "exerciseId": "ex-bench",
            "startedAt": "2026-09-25T10:00:00Z",
            "endedAt": "2026-09-25T10:05:00Z",
            "avgHeartRateBpm": 130,
            "maxHeartRateBpm": 150
          }
        ]
      }
    ]
  }
}
