{
  "protocolVersion": 1,
  "messageId": "msg-obs-assist",
  "sessionId": "s-58",
  "type": "observations_up",
  "origin": "watch",
  "sentAt": "2026-10-06T18:20:00Z",
  "payload": {
    "events": [
      {
        "eventId": "evt-distance-1",
        "entryId": "evt-distance-1",
        "kind": "timed",
        "loggedAt": "2026-10-06T18:06:00Z",
        "sessionExerciseId": "sx-ride",
        "exerciseId": "ex-stationary-bike",
        "startedAt": "2026-10-06T18:00:00Z",
        "endedAt": "2026-10-06T18:06:00Z",
        "distanceMeters": 2400
      },
      {
        "eventId": "evt-assist-1",
        "entryId": "evt-assist-1",
        "kind": "set",
        "loggedAt": "2026-10-06T18:12:00Z",
        "sessionExerciseId": "sx-bench",
        "exerciseId": "ex-bench",
        "reps": 8,
        "loadKg": -20
      },
      {
        "eventId": "evt-assist-2",
        "entryId": "evt-assist-2",
        "kind": "set",
        "loggedAt": "2026-10-06T18:14:00Z",
        "sessionExerciseId": "sx-bench",
        "exerciseId": "ex-bench",
        "reps": 5,
        "loadKg": -200
      }
    ]
  }
}
