{
  "protocolVersion": 1,
  "messageId": "msg-push-1",
  "sessionId": "s-2026-07-13-1",
  "type": "exercise_push",
  "origin": "phone",
  "sentAt": "2026-07-13T17:41:00Z",
  "payload": {
    "insertAtIndex": 3,
    "exercise": {
      "sessionExerciseId": "sx-pullup",
      "exerciseId": "ex-pull-up",
      "name": "Pull-Up",
      "capabilities": ["sets", "reps", "load"]
    }
  }
}
