{
  "protocolVersion": 1,
  "messageId": "msg-exercises-v1-3-9f8e7d6c-0",
  "type": "exercises_down",
  "origin": "phone",
  "sentAt": "2026-07-13T17:00:00Z",
  "payload": {
    "generatedAt": "2026-07-13T17:00:00Z",
    "catalogVersion": "v1-3-9f8e7d6c",
    "batchIndex": 0,
    "batchCount": 1,
    "totalCount": 3,
    "exercises": [
      {
        "exerciseId": "ex-barbell-bench-press",
        "name": "Barbell Bench Press",
        "capabilities": ["sets", "reps", "load"]
      },
      {
        "exerciseId": "ex-plank",
        "name": "Plank",
        "capabilities": ["time", "hold"]
      },
      {
        "exerciseId": "ex-soccer",
        "name": "Soccer",
        "capabilities": ["time", "rounds"],
        "roundDurationSecs": 2400
      }
    ]
  }
}
