{
  "protocolVersion": 1,
  "messageId": "msg-obs-paused-ms-equals-window",
  "sessionId": "s-cap-fx",
  "type": "observations_up",
  "origin": "watch",
  "sentAt": "2026-09-25T11:00:00Z",
  "payload": {
    "events": [
      {
        "eventId": "e-paused-equals-window",
        "entryId": "e-paused-equals-window",
        "kind": "round",
        "loggedAt": "2026-09-25T10:30:00Z",
        "sessionExerciseId": "sx-bjj",
        "exerciseId": "ex-bjj",
        "startedAt": "2026-09-25T10:25:00Z",
        "endedAt": "2026-09-25T10:30:00Z",
        "roundNumber": 1,
        "pausedMs": 300000
      }
    ]
  }
}
