{
  "protocolVersion": 1,
  "messageId": "msg-timers-slot-1",
  "sessionId": "s-2026-07-13-1",
  "type": "timer_state",
  "origin": "watch",
  "sentAt": "2026-07-13T17:33:00Z",
  "payload": {
    "timers": {
      "hold": {
        "kind": "hold",
        "state": "running",
        "startedAt": "2026-07-13T17:29:00Z",
        "accumulatedPauseMs": 0,
        "sessionExerciseId": "sx-run"
      },
      "elapsed": {
        "kind": "elapsed",
        "state": "running",
        "startedAt": "2026-07-13T17:05:00Z",
        "accumulatedPauseMs": 0,
        "sessionExerciseId": "sx-bike"
      }
    }
  }
}
