{
  "protocolVersion": 1,
  "messageId": "msg-preferences-accent",
  "type": "preferences_down",
  "origin": "phone",
  "sentAt": "2026-09-25T09:00:00Z",
  "payload": {
    "generatedAt": "2026-09-25T09:00:00Z",
    "effortRatingPrompt": false,
    "restPingSeconds": 90,
    "accentColorHex": "#2DE2E6"
  }
}
