{
  "protocolVersion": 1,
  "messageId": "msg-obs-ds-valid",
  "sessionId": "s-ds",
  "type": "observations_up",
  "origin": "watch",
  "sentAt": "2026-09-27T11:00:00Z",
  "payload": {
    "events": [
      {
        "eventId": "e-ds-gps",
        "entryId": "e-ds-gps",
        "kind": "timed",
        "loggedAt": "2026-09-27T10:30:00Z",
        "sessionExerciseId": "sx-run",
        "exerciseId": "ex-run",
        "startedAt": "2026-09-27T10:10:00Z",
        "endedAt": "2026-09-27T10:30:00Z",
        "distanceMeters": 5000,
        "distanceSource": "gps"
      },
      {
        "eventId": "e-ds-entered",
        "entryId": "e-ds-entered",
        "kind": "timed",
        "loggedAt": "2026-09-27T10:31:00Z",
        "sessionExerciseId": "sx-run",
        "exerciseId": "ex-run",
        "startedAt": "2026-09-27T10:11:00Z",
        "endedAt": "2026-09-27T10:31:00Z",
        "distanceMeters": 3000,
        "distanceSource": "entered"
      },
      {
        "eventId": "e-ds-est",
        "entryId": "e-ds-est",
        "kind": "timed",
        "loggedAt": "2026-09-27T10:32:00Z",
        "sessionExerciseId": "sx-run",
        "exerciseId": "ex-run",
        "startedAt": "2026-09-27T10:12:00Z",
        "endedAt": "2026-09-27T10:32:00Z",
        "distanceMeters": 4200,
        "distanceSource": "estimated"
      }
    ]
  }
}
